id,title,tags,contents,external-link,direct-download-link,size,thumbnail-image,featured
ds1,Twitter data,"['Twitter', 'Big data', 'Raw data']","This dataset contains all the datasets used in the study conducted for the research publication titled ""Mapping dynamic human sentiments of heat exposure with location-based social media data"".",https://figshare.com/articles/dataset/Data_Sample_for_Mapping_Dynamic_Human_Sentiments_of_Heat_Exposure_with_Location-Based_Social_Media_Data_/21780065,twitterjson-210925to210926/twitter_gz/,29.80 GB,/images/dataset_images/ds1.png,True
ds2,Heat Dictionary,"['Heat dictionary', 'Twitter']","The heat dictionary is generated with Word2vec, which is a well-known and extensively used tool in keyword-based sentimental analysis. It comprises a compilation of weather-related words and phrases paired with corresponding values ranging from -1 to 1, indicating their relevance to the notion of hot weather. The greater the value, the more it is relevant to hot weather.",https://databank.illinois.edu/datasets/IDB-9405860,https://databank.illinois.edu/datasets/IDB-9405860,2.25 MB,/images/dataset_images/ds2.png,false
ds3,County Level US Boundary Shapefile,"['US', 'Boundary', 'Shapefile']",The cartographic boundary files are simplified representations of selected geographic areas from the Census Bureau's MAF/TIGER geographic database. These boundary files are specifically designed for small scale thematic mapping. The cartographic boundary files are available in shapefile. A shapefile is a geospatial data format for use in geographic information system (GIS) software. This dataset includes county level boundary shapefiles for US.,https://databank.illinois.edu/datasets/IDB-9405860,https://databank.illinois.edu/datasets/IDB-9405860,2.25 MB,/images/dataset_images/ds3.png,false
ds4,Census tract level Chicago Boundary Shapefile,"['Chicago', 'Boundary', 'Shapefile']","The cartographic boundary files are simplified representations of selected geographic areas from the Census Bureau's MAF/TIGER geographic database. These boundary files are specifically designed for small scale thematic mapping. The cartographic boundary files are available in shapefile. A shapefile is a geospatial data format for use in geographic information system (GIS) software. This dataset includes boundary shapefiles for the Chicago, US region at census tract level.",https://databank.illinois.edu/datasets/IDB-9405860,https://databank.illinois.edu/datasets/IDB-9405860,2.25 MB,/images/dataset_images/ds4.png,false
ds5,National Inventory of Dams,"['Dam', 'Infrastructure']","The National Inventory of Dams (NID) documents all known dams in the U.S. and its territories that meet certain criteria. It is designed to provide a variety of users the ability to search for specific data about dams in the U.S. and serves as a resource to support awareness of dams and actions to prepare for a dam-related emergency. USACE is responsible for maintaining the NID and works in close collaboration with federal dam regulating agencies, including the Federal Emergency Management Agency (FEMA) and federal and state dam regulating agencies, to obtain accurate and complete information about dams in the database. The database contains information about a dam's location, type, size, purpose, uses and benefits, date of last inspection, other structural and geographical information, and much more (there are more than 70 data fields for each dams). The NID is also used to assist federal, state, and local agencies develop dam safety policies.",https://iguide.cuahsi.io/dataset/64f0a96e777ca314fe6b6004,https://nid.sec.usace.army.mil/#/downloads,,/images/dataset_images/ds5.png,false
ds6,Google News Articles - Aging Dams,"['Aging-Dams', 'HyperCube', 'Dam', 'News']",News articles collected by searching words 'aging dams' in Google News and news websites. 188 news articles in total.,https://www.hydroshare.org/resource/08745ae940ab4433b6f73de6b79088f7/,https://www.hydroshare.org/resource/08745ae940ab4433b6f73de6b79088f7/,,/images/dataset_images/ds6.png,false
ds7,Analysis-Ready Tables from International Censuses,"['IPUMS IHGIS', 'Demographics', 'Education', 'Employment', 'Crops']","The IPUMS International Historical Geographic Information System (IHGIS) provides data tables from population and housing censuses and agricultural censuses from around the world, along with corresponding GIS boundary files.",https://data.ihgis.ipums.org,,,/images/dataset_images/ds7.png,false
ds8,Intermediate Results for Human Sentiments of Heat Exposure,['Human Sentiments of Heat Exposure'],This data include example intermediate results for human sentiments of heat exposure at national-level at the US and city-level at the city of Chicago.,https://github.com/I-GUIDE/data-with-notebooks-inventory/tree/main/human_sentiments_of_heat,,2 MB,/images/dataset_images/ds8.png,false
